<?xml version="1.0"?>
<Oglasi xmlns="https://www.w3schools.com" xmlns:xsi="http://www.w3.org/2001/XMLSchema-instance" xsi:schemaLocation="https://www.w3schools.com oglasiV.xsd">
    <Oglas>
        <Kategorija>Automobil</Kategorija>
        <Datum>
            <Dan>6</Dan>
            <Mesec>8</Mesec>
            <Godina>2022</Godina>
        </Datum>
        <Cena valuta="eur">2000</Cena>
        <Tekst>Tekst oglasa</Tekst>
        <Tagovi>
            <Tag>1992</Tag>
            <Tag>Benzin</Tag>
        </Tagovi>
        <kontakt>
            <email tip="privatni">bogdan@gmail.com</email>
            <email tip="sluzbeni">bogdannrt1519@gs.viser.edu.rs</email>
        </kontakt>
    </Oglas>
    <Oglas>
        <Kategorija>Stan</Kategorija>
        <Datum>
            <Dan>2</Dan>
            <Mesec>5</Mesec>
            <Godina>2021</Godina>
        </Datum>
        <Cena valuta="eur">50000</Cena>
        <Tekst>Stan u beogradu</Tekst>
        <Tagovi>
            <Tag>100m2</Tag>
            <Tag>Vozdovac</Tag>
        </Tagovi>
        <kontakt>
            <email tip="privatni">petar@gmail.com</email>
        </kontakt>
    </Oglas>
</Oglasi>
